<?xml version="1.0" encoding="UTF-8"?>
<tns:planes xmlns:tns="http://www.example.org/planesSchema"
	xmlns:xsi="http://www.w3.org/2001/XMLSchema-instance"
	xsi:schemaLocation="http://www.example.org/planesSchema planesSchema.xsd ">
	
	<plane  nrName="Blackbird">
		<model>SR-71</model>
		<origin>USA</origin>
		<chars>
			<type>reconnaissance</type>
			<crew>2</crew>
			<radar>yes</radar>
		</chars>
		<parameters>
			<length>32.74</length>
			<width>16.94</width>
			<height>5.64</height>
		</parameters>
		<price>200000000</price>
	</plane>
	
	<plane nrName="Flanker-T">
		<model>SU-35</model>
		<origin>Russia</origin>
		<chars>
			<type>fighter</type>
			<crew>1</crew>
			<armament>10</armament>
			<radar>yes</radar>
		</chars>
		<parameters>
			<length>22.18</length>
			<width>14.75</width>
			<height>6.43</height>
		</parameters>
		<price>40000000</price>
	</plane>
	
	<plane nrName="Raptor">
		<model>F-22</model>
		<origin>USA</origin>
		<chars>
			<type>fighter</type>
			<crew>1</crew>
			<armament>8</armament>
			<radar>yes</radar>
		</chars>
		<parameters>
			<length>18.9</length>
			<width>13.56</width>
			<height>5.09</height>
		</parameters>
		<price>140000000</price>
	</plane>
</tns:planes>